id,text,labels,cleaned_text,bert_large_glove,bert_base_glove,bert_base,bert_large,ground,scores-bert_large_glove,scores-bert_large,scores-bert_base_glove,scores-bert_base,p_scores-bert_large_glove,p_scores-bert_large,p_scores-bert_base_glove,p_scores-bert_base,r_scores-bert_large_glove,r_scores-bert_large,r_scores-bert_base_glove,r_scores-bert_base
4151,"What a town of morons. Turn down MEDICINE, look it up, ignorance is so blissful, you must be happy as pigs in poop down there in Creswell. Wowza, the stupidity that must ooze from the local cafe's, cheering how they beat the evil pot people. Get a life you ignoramuses, CANNABIS has been a MEDICINE in the US since about 1840. Grow up and accept it, you're fear is unfounded and your ignorance, is beaming.","[[15, 20, 'Toxic'], [150, 158, 'Toxic']]",What a town of morons  Turn down MEDICINE  look it up  ignorance is so blissful  you must be happy as pigs in poop down there in Creswell  Wowza  the stupidity that must ooze from the local cafe s  cheering how they beat the evil pot people  Get a life you ignoramuses  CANNABIS has been a MEDICINE in the US since about 1840  Grow up and accept it  you re fear is unfounded and your ignorance  is beaming ,"[15, 16, 17, 18, 19, 20, 150, 151, 152, 153, 154, 155, 156, 157, 158]","[15, 16, 17, 18, 19, 20, 150, 151, 152, 153, 154, 155, 156, 157, 158]","[15, 16, 17, 18, 19, 20, 150, 151, 152, 153, 154, 155, 156, 157, 158]","[15, 16, 17, 18, 19, 20, 150, 151, 152, 153, 154, 155, 156, 157, 158]","[15, 16, 17, 18, 19, 20, 150, 151, 152, 153, 154, 155, 156, 157, 158]",1.0,1.0,1.0,1.0,1.0,1.0,1.0,1.0,1.0,1.0,1.0,1.0
4153,Typing in all caps just brings more attention to the fact that you're either ignorant of the facts or a liar. Which is it?,"[[104, 107, 'Toxic']]",Typing in all caps just brings more attention to the fact that you re either ignorant of the facts or a liar  Which is it ,"[77, 78, 79, 80, 81, 82, 83, 84, 104, 105, 106, 107]","[77, 78, 79, 80, 81, 82, 83, 84, 104, 105, 106, 107]","[77, 78, 79, 80, 81, 82, 83, 84, 104, 105, 106, 107]","[77, 78, 79, 80, 81, 82, 83, 84, 104, 105, 106, 107]","[104, 105, 106, 107]",0.5,0.5,0.5,0.5,0.7142857142857143,0.7142857142857143,0.7142857142857143,0.7142857142857143,1.0,1.0,1.0,1.0
4154,"Antle informs us about one district that Trump ""won by less than 10 points"". Somehow this is supposed to indicate that the departure of a Trump-opposing do-nothing will be a loss for the party rather than an opportunity to get something useful out of a Trump-favoring district. The stupidity is strong in these NeverTrumpers.","[[282, 290, 'Toxic']]",Antle informs us about one district that Trump  won by less than 10 points   Somehow this is supposed to indicate that the departure of a Trump opposing do nothing will be a loss for the party rather than an opportunity to get something useful out of a Trump favoring district  The stupidity is strong in these NeverTrumpers ,"[282, 283, 284, 285, 286, 287, 288, 289, 290]","[282, 283, 284, 285, 286, 287, 288, 289, 290]","[282, 283, 284, 285, 286, 287, 288, 289, 290]","[282, 283, 284, 285, 286, 287, 288, 289, 290]","[282, 283, 284, 285, 286, 287, 288, 289, 290]",1.0,1.0,1.0,1.0,1.0,1.0,1.0,1.0,1.0,1.0,1.0,1.0
4170,Liberals never grow tired of making fools of themselves.,"[[36, 40, 'Toxic']]",Liberals never grow tired of making fools of themselves ,"[36, 37, 38, 39, 40]","[36, 37, 38, 39, 40]","[36, 37, 38, 39, 40]","[36, 37, 38, 39, 40]","[36, 37, 38, 39, 40]",1.0,1.0,1.0,1.0,1.0,1.0,1.0,1.0,1.0,1.0,1.0,1.0
4176,"As an Arizonan, I am embarrassed by his man who calls himself our senator!  Go home, get your cancer treatments, RETIRE and keep your mouth shut about our President, especially when in a foreign country!  Idiotic!","[[205, 211, 'Toxic']]",As an Arizonan  I am embarrassed by his man who calls himself our senator   Go home  get your cancer treatments  RETIRE and keep your mouth shut about our President  especially when in a foreign country   Idiotic ,"[205, 206, 207, 208, 209, 210, 211]","[205, 206, 207, 208, 209, 210, 211]","[205, 206, 207, 208, 209, 210, 211]","[205, 206, 207, 208, 209, 210, 211]","[205, 206, 207, 208, 209, 210, 211]",1.0,1.0,1.0,1.0,1.0,1.0,1.0,1.0,1.0,1.0,1.0,1.0
4191,That's what happens when a complete moron is in charge. The stupidity is mind boggling.,"[[60, 68, 'Toxic']]",That s what happens when a complete moron is in charge  The stupidity is mind boggling ,"[36, 37, 38, 39, 40, 60, 61, 62, 63, 64, 65, 66, 67, 68]","[36, 37, 38, 39, 40, 60, 61, 62, 63, 64, 65, 66, 67, 68]","[36, 37, 38, 39, 40, 60, 61, 62, 63, 64, 65, 66, 67, 68]","[36, 37, 38, 39, 40, 60, 61, 62, 63, 64, 65, 66, 67, 68]","[60, 61, 62, 63, 64, 65, 66, 67, 68]",0.7826086956521741,0.7826086956521741,0.7826086956521741,0.7826086956521741,0.9285714285714286,0.9285714285714286,0.9285714285714286,0.9285714285714286,1.0,1.0,1.0,1.0
4192,"I consider a large portion of the Muslims to be
"" barbarians"".
I also consider the Mexican gangs, MS13 to be ""barbarians"".","[[83, 95, 'Toxic'], [110, 119, 'Toxic']]","I consider a large portion of the Muslims to be
  barbarians  
I also consider the Mexican gangs  MS13 to be  barbarians  ","[50, 51, 52, 53, 54, 55, 56, 57, 58, 59, 110, 111, 112, 113, 114, 115, 116, 117, 118, 119]","[50, 51, 52, 53, 54, 55, 56, 57, 58, 59, 110, 111, 112, 113, 114, 115, 116, 117, 118, 119]","[50, 51, 52, 53, 54, 55, 56, 57, 58, 59, 110, 111, 112, 113, 114, 115, 116, 117, 118, 119]","[50, 51, 52, 53, 54, 55, 56, 57, 58, 59, 110, 111, 112, 113, 114, 115, 116, 117, 118, 119]","[83, 84, 85, 86, 87, 88, 89, 90, 91, 92, 93, 94, 95, 110, 111, 112, 113, 114, 115, 116, 117, 118, 119]",0.4651162790697674,0.4651162790697674,0.4651162790697674,0.4651162790697674,1.0,1.0,1.0,1.0,1.0,1.0,1.0,1.0
4200,"True but the president is supposed to lead, not follow.  What a failed presidency.  No leadership whatsoever.  Even GW was better than this clown.","[[98, 107, 'Toxic'], [140, 144, 'Toxic']]",True but the president is supposed to lead  not follow   What a failed presidency   No leadership whatsoever   Even GW was better than this clown ,"[140, 141, 142, 143, 144]","[140, 141, 142, 143, 144]","[140, 141, 142, 143, 144]","[140, 141, 142, 143, 144]","[98, 99, 100, 101, 102, 103, 104, 105, 106, 107, 140, 141, 142, 143, 144]",0.5,0.5,0.5,0.5,1.0,1.0,1.0,1.0,0.6428571428571429,0.6428571428571429,0.6428571428571429,0.6428571428571429
4212,"OMG! Ha Ha Ha now that is funny..."" Second, letâ€™s not be naive in thinking the sky is falling;"" Try telling that one to the Democrats and their ""Pink Pussy Hat"" drama queens.","[[150, 154, 'Toxic']]",OMG  Ha Ha Ha now that is funny     Second  let s not be naive in thinking the sky is falling   Try telling that one to the Democrats and their  Pink Pussy Hat  drama queens ,"[150, 151, 152, 153, 154, 155, 156, 157, 158]","[150, 151, 152, 153, 154, 155, 156, 157, 158]","[150, 151, 152, 153, 154, 161, 162, 163, 164, 165]","[150, 151, 152, 153, 154]","[150, 151, 152, 153, 154]",0.7142857142857143,1.0,0.7142857142857143,0.6666666666666666,0.7692307692307693,1.0,0.7692307692307693,0.9090909090909091,1.0,1.0,1.0,1.0
4218,"This is the height of Canadian media's stupidity.  We have Boy Justin literally wrecking our country and the media clowns key on this.  Geez I wonder why the media has lost any and all trust of the general public.

You're a credit to the Liberal Party of Canada, Globe and Mail but that's all you are a credit to.","[[39, 47, 'Toxic']]","This is the height of Canadian media s stupidity   We have Boy Justin literally wrecking our country and the media clowns key on this   Geez I wonder why the media has lost any and all trust of the general public 

You re a credit to the Liberal Party of Canada  Globe and Mail but that s all you are a credit to ","[39, 40, 41, 42, 43, 44, 45, 46, 47]","[39, 40, 41, 42, 43, 44, 45, 46, 47]","[39, 40, 41, 42, 43, 44, 45, 46, 47]","[39, 40, 41, 42, 43, 44, 45, 46, 47]","[39, 40, 41, 42, 43, 44, 45, 46, 47]",1.0,1.0,1.0,1.0,1.0,1.0,1.0,1.0,1.0,1.0,1.0,1.0
4227,"So this will be a Trump designed war to justify his rhetoric?

There really will be a need to ""make America Great Again"" after that idiot has brought America to its knees","[[132, 136, 'Toxic']]","So this will be a Trump designed war to justify his rhetoric 

There really will be a need to  make America Great Again  after that idiot has brought America to its knees","[132, 133, 134, 135, 136]","[132, 133, 134, 135, 136]","[132, 133, 134, 135, 136]","[132, 133, 134, 135, 136]","[132, 133, 134, 135, 136]",1.0,1.0,1.0,1.0,1.0,1.0,1.0,1.0,1.0,1.0,1.0,1.0
4232,"The only commies in the US are people just like you, you moron.","[[57, 61, 'Toxic']]",The only commies in the US are people just like you  you moron ,"[57, 58, 59, 60, 61]","[57, 58, 59, 60, 61]","[57, 58, 59, 60, 61]","[57, 58, 59, 60, 61]","[57, 58, 59, 60, 61]",1.0,1.0,1.0,1.0,1.0,1.0,1.0,1.0,1.0,1.0,1.0,1.0
4234,Cull the herd.,"[[9, 12, 'Toxic']]",Cull the herd ,"[0, 1, 2, 3, 4, 5, 6, 7, 8, 9, 10, 11, 12]","[0, 1, 2, 3, 4, 5, 6, 7]","[0, 1, 2, 3, 4, 5, 6, 7, 8, 9, 10, 11, 12]","[0, 1, 2, 3, 4, 5, 6, 7, 8, 9, 10, 11, 12]","[9, 10, 11, 12]",0.4705882352941176,0.4705882352941176,0.0,0.4705882352941176,0.5714285714285714,0.5714285714285714,0.5833333333333334,0.5714285714285714,1.0,1.0,0.875,1.0
4252,"The harm T-rump is doing to America is bad enough, but now he wants to inflict his idiocies on other countries. 

No thanks.","[[83, 90, 'Toxic']]","The harm T rump is doing to America is bad enough  but now he wants to inflict his idiocies on other countries  

No thanks ","[83, 84, 85, 86, 87, 88, 89, 90]","[83, 84, 85, 86, 87, 88, 89, 90]","[83, 84, 85, 86, 87, 88, 89, 90]","[11, 12, 13, 14, 83, 84, 85, 86, 87, 88, 89, 90]","[83, 84, 85, 86, 87, 88, 89, 90]",1.0,0.8,1.0,1.0,1.0,0.8571428571428571,1.0,1.0,1.0,1.0,1.0,1.0
4254,"Deaths like this are encouraged every time a driver is excused from charges for hitting someone who wore dark clothing that day, or some other pitiful excuse for reckless driving. We should be seeing flashing lights all over the state slowing these irresponsible bastards down.","[[263, 270, 'Toxic']]",Deaths like this are encouraged every time a driver is excused from charges for hitting someone who wore dark clothing that day  or some other pitiful excuse for reckless driving  We should be seeing flashing lights all over the state slowing these irresponsible bastards down ,"[263, 264, 265, 266, 267, 268, 269, 270]","[263, 264, 265, 266, 267, 268, 269, 270]","[263, 264, 265, 266, 267, 268, 269, 270]","[263, 264, 265, 266, 267, 268, 269, 270]","[263, 264, 265, 266, 267, 268, 269, 270]",1.0,1.0,1.0,1.0,1.0,1.0,1.0,1.0,1.0,1.0,1.0,1.0
4275,"When asked if they were going to screw over other stores, Chambers avoided the question and essentially stated that because they can and because she's a stupid  beeotch they're going to concentrate exclusively on marijuana stores.","[[153, 166, 'Toxic']]",When asked if they were going to screw over other stores  Chambers avoided the question and essentially stated that because they can and because she s a stupid  beeotch they re going to concentrate exclusively on marijuana stores ,"[153, 154, 155, 156, 157, 158]","[153, 154, 155, 156, 157, 158]","[153, 154, 155, 156, 157, 158]","[153, 154, 155, 156, 157, 158]","[153, 154, 155, 156, 157, 158, 159, 160, 161, 162, 163, 164, 165, 166]",0.6,0.6,0.6,0.6,1.0,1.0,1.0,1.0,0.7857142857142857,0.7857142857142857,0.7857142857142857,0.7857142857142857
4296,Very interesting ... What will Trump do next? Ban all Muslim?,"[[54, 59, 'Toxic']]",Very interesting     What will Trump do next  Ban all Muslim ,"[54, 55, 56, 57, 58, 59]","[54, 55, 56, 57, 58, 59]","[54, 55, 56, 57, 58, 59]","[54, 55, 56, 57, 58, 59]","[54, 55, 56, 57, 58, 59]",1.0,1.0,1.0,1.0,1.0,1.0,1.0,1.0,1.0,1.0,1.0,1.0
4305,"wow you really are an ignorant usa hater arnt you,, that was ww2 and they stopped the war, NK wants to start one you child of bs","[[22, 29, 'Toxic']]",wow you really are an ignorant usa hater arnt you   that was ww2 and they stopped the war  NK wants to start one you child of bs,"[22, 23, 24, 25, 26, 27, 28, 29]","[22, 23, 24, 25, 26, 27, 28, 29]","[22, 23, 24, 25, 26, 27, 28, 29]","[22, 23, 24, 25, 26, 27, 28, 29]","[22, 23, 24, 25, 26, 27, 28, 29]",1.0,1.0,1.0,1.0,1.0,1.0,1.0,1.0,1.0,1.0,1.0,1.0
4310,All you guys are jerks (below)   would you rather us sleeping is your parks or by your doors? Think before you group all the homeless together in one big group. I for one know I'm not a scum junky.. there is a difference,"[[17, 21, 'Toxic'], [186, 195, 'Toxic']]",All you guys are jerks  below    would you rather us sleeping is your parks or by your doors  Think before you group all the homeless together in one big group  I for one know I m not a scum junky   there is a difference,"[17, 18, 19, 20, 21, 186, 187, 188, 189, 190, 191, 192, 193, 194, 195]","[17, 18, 19, 20, 21, 186, 187, 188, 189, 190, 191, 192, 193, 194, 195]","[17, 18, 19, 20, 21, 186, 187, 188, 189]","[17, 18, 19, 20, 21, 186, 187, 188, 189]","[17, 18, 19, 20, 21, 186, 187, 188, 189, 190, 191, 192, 193, 194, 195]",1.0,0.75,1.0,0.75,1.0,1.0,1.0,1.0,1.0,0.7857142857142857,1.0,0.7857142857142857
4315,"Klima sounds just lovely.  We haven't had one of him in years, but since Trump and his idiot followers have been glorifying hatred, racism, bigotry, sexual perversion, religious nuttery and the like, I suppose we're going to have to deal with this kind of thing again.","[[87, 91, 'Toxic']]",Klima sounds just lovely   We haven t had one of him in years  but since Trump and his idiot followers have been glorifying hatred  racism  bigotry  sexual perversion  religious nuttery and the like  I suppose we re going to have to deal with this kind of thing again ,"[87, 88, 89, 90, 91]","[87, 88, 89, 90, 91]","[87, 88, 89, 90, 91]","[87, 88, 89, 90, 91]","[87, 88, 89, 90, 91]",1.0,1.0,1.0,1.0,1.0,1.0,1.0,1.0,1.0,1.0,1.0,1.0
4332,Not really sure what this has to do with Trudeau. It seems that you just have a hate on for him and desperately trying to connect this to him somehow. It makes you seem sympathetic to the American Nazis and their idiot president. Was that what you were going for?,"[[213, 217, 'Toxic']]",Not really sure what this has to do with Trudeau  It seems that you just have a hate on for him and desperately trying to connect this to him somehow  It makes you seem sympathetic to the American Nazis and their idiot president  Was that what you were going for ,"[213, 214, 215, 216, 217]","[213, 214, 215, 216, 217]","[213, 214, 215, 216, 217]","[213, 214, 215, 216, 217]","[213, 214, 215, 216, 217]",1.0,1.0,1.0,1.0,1.0,1.0,1.0,1.0,1.0,1.0,1.0,1.0
4336,"Hypocrite central , hillarys a sewer rat","[[0, 8, 'Toxic'], [37, 39, 'Toxic']]",Hypocrite central   hillarys a sewer rat,"[0, 1, 2, 3, 4, 5, 6, 7, 8]","[0, 1, 2, 3, 4, 5, 6, 7, 8]","[0, 1, 2, 3, 4, 5, 6, 7, 8, 37, 38, 39]","[0, 1, 2, 3, 4, 5, 6, 7, 8, 31, 32, 33, 34, 35]","[0, 1, 2, 3, 4, 5, 6, 7, 8, 37, 38, 39]",0.8571428571428571,0.6923076923076923,0.8571428571428571,1.0,1.0,1.0,1.0,1.0,0.9285714285714286,0.9285714285714286,0.9285714285714286,1.0
4348,"No, but I want them to end this stupid fiscal hostage taking and  focus on teaching not on administering and what better way to cull the heard (so to speak). I would ask you if a highly compensated administrator who was laid off  would actually take up the offer?","[[32, 37, 'Toxic']]",No  but I want them to end this stupid fiscal hostage taking and  focus on teaching not on administering and what better way to cull the heard  so to speak   I would ask you if a highly compensated administrator who was laid off  would actually take up the offer ,"[32, 33, 34, 35, 36, 37]","[32, 33, 34, 35, 36, 37]","[32, 33, 34, 35, 36, 37]","[32, 33, 34, 35, 36, 37]","[32, 33, 34, 35, 36, 37]",1.0,1.0,1.0,1.0,1.0,1.0,1.0,1.0,1.0,1.0,1.0,1.0
4356,"Muons???  My arse!  I ain't ever seen no ""muons.""  If you fall for this, you probably believe in global warming.  This is another Chinese hoax aimed at weakening 'murica.  These so-called ""scientists"" just grabbed onto this to get more funding for more ""research"" to give them job security.","[[0, 4, 'Toxic'], [189, 198, 'Toxic']]",Muons     My arse   I ain t ever seen no  muons    If you fall for this  you probably believe in global warming   This is another Chinese hoax aimed at weakening  murica   These so called  scientists  just grabbed onto this to get more funding for more  research  to give them job security ,"[13, 14, 15, 16]","[13, 14, 15, 16]","[13, 14, 15, 16]","[13, 14, 15, 16]","[0, 1, 2, 3, 4, 189, 190, 191, 192, 193, 194, 195, 196, 197, 198]",0.0,0.0,0.0,0.0,1.0,1.0,1.0,1.0,0.6428571428571429,0.6428571428571429,0.6428571428571429,0.6428571428571429
4365,Those damn left hands!!!!,"[[6, 9, 'Toxic'], [16, 20, 'Toxic']]",Those damn left hands    ,"[6, 7, 8, 9]","[6, 7, 8, 9]","[6, 7, 8, 9]","[6, 7, 8, 9]","[6, 7, 8, 9, 16, 17, 18, 19, 20]",0.6153846153846154,0.6153846153846154,0.6153846153846154,0.6153846153846154,1.0,1.0,1.0,1.0,0.7272727272727273,0.7272727272727273,0.7272727272727273,0.7272727272727273
4371,You can thank the imbeciles who voted for these twits.,"[[18, 26, 'Toxic']]",You can thank the imbeciles who voted for these twits ,"[18, 19, 20, 21, 22, 23, 24, 25, 26]","[18, 19, 20, 21, 22, 23, 24, 25, 26, 48, 49, 50, 51, 52]","[18, 19, 20, 21, 22, 23, 24, 25, 26, 48, 49, 50, 51, 52]","[18, 19, 20, 21, 22, 23, 24, 25, 26]","[18, 19, 20, 21, 22, 23, 24, 25, 26]",1.0,1.0,0.7826086956521741,0.7826086956521741,1.0,1.0,1.0,1.0,1.0,1.0,1.0,1.0
4381,Fox news could not have said it better.  You stupid lapdogs who live in Hawaii and only understand immigration through the eyes of Fox News and Steve Bannon.,"[[32, 37, 'Toxic'], [45, 50, 'Toxic']]",Fox news could not have said it better   You stupid lapdogs who live in Hawaii and only understand immigration through the eyes of Fox News and Steve Bannon ,"[45, 46, 47, 48, 49, 50]","[45, 46, 47, 48, 49, 50]","[45, 46, 47, 48, 49, 50]","[45, 46, 47, 48, 49, 50]","[32, 33, 34, 35, 36, 37, 45, 46, 47, 48, 49, 50]",0.6666666666666666,0.6666666666666666,0.6666666666666666,0.6666666666666666,1.0,1.0,1.0,1.0,0.8461538461538461,0.8461538461538461,0.8461538461538461,0.8461538461538461
4388,"DÃ¼stin ""the moron"" Darden can't even spell ""floride"" let alone understand it.","[[8, 16, 'Toxic']]",DÃ¼stin  the moron  Darden can t even spell  floride  let alone understand it ,"[12, 13, 14, 15, 16]","[12, 13, 14, 15, 16]","[12, 13, 14, 15, 16]","[12, 13, 14, 15, 16]","[8, 9, 10, 11, 12, 13, 14, 15, 16]",0.7142857142857143,0.7142857142857143,0.7142857142857143,0.7142857142857143,1.0,1.0,1.0,1.0,0.7692307692307693,0.7692307692307693,0.7692307692307693,0.7692307692307693
4390,"""Meanwhile, it is the economy, stupid.""

----------

Yes...Trudeau is wrecking it.","[[31, 36, 'Toxic']]"," Meanwhile  it is the economy  stupid  

          

Yes   Trudeau is wrecking it ","[31, 32, 33, 34, 35, 36]","[31, 32, 33, 34, 35, 36]","[31, 32, 33, 34, 35, 36]","[31, 32, 33, 34, 35, 36]","[31, 32, 33, 34, 35, 36]",1.0,1.0,1.0,1.0,1.0,1.0,1.0,1.0,1.0,1.0,1.0,1.0
4393,Stop killing animals and we'll leave you alone.,"[[5, 11, 'Toxic'], [13, 19, 'Toxic']]",Stop killing animals and we ll leave you alone ,"[5, 6, 7, 8, 9, 10, 11, 12, 13, 14, 15, 16, 17, 18, 19]","[5, 6, 7, 8, 9, 10, 11, 12, 13, 14, 15, 16, 17, 18, 19]","[5, 6, 7, 8, 9, 10, 11]","[5, 6, 7, 8, 9, 10, 11, 13, 14, 15, 16, 17, 18, 19]","[5, 6, 7, 8, 9, 10, 11, 13, 14, 15, 16, 17, 18, 19]",0.9655172413793104,1.0,0.9655172413793104,0.6666666666666666,0.9285714285714286,1.0,0.9285714285714286,1.0,1.0,1.0,1.0,0.8461538461538461
4401,What a hypocrite - he said absolutely nothing when his boss (BHO) BOWED to Muslim/Islamic heads of state and other foreign leaders.  The President of the U.S. NEVER bows to anyone!  Oh - sorry I forgot that POS BHO's excuse for bowing was his shoe was untied!  Brennen you are a disgrace and you served your  country dishonorably.  Loser!,"[[7, 15, 'Toxic'], [279, 286, 'Toxic'], [317, 328, 'Toxic'], [332, 336, 'Toxic']]",What a hypocrite   he said absolutely nothing when his boss  BHO  BOWED to Muslim Islamic heads of state and other foreign leaders   The President of the U S  NEVER bows to anyone   Oh   sorry I forgot that POS BHO s excuse for bowing was his shoe was untied   Brennen you are a disgrace and you served your  country dishonorably   Loser ,"[7, 8, 9, 10, 11, 12, 13, 14, 15]","[7, 8, 9, 10, 11, 12, 13, 14, 15, 332, 333, 334, 335, 336]","[7, 8, 9, 10, 11, 12, 13, 14, 15, 332, 333, 334, 335, 336]","[7, 8, 9, 10, 11, 12, 13, 14, 15, 332, 333, 334, 335, 336]","[7, 8, 9, 10, 11, 12, 13, 14, 15, 279, 280, 281, 282, 283, 284, 285, 286, 317, 318, 319, 320, 321, 322, 323, 324, 325, 326, 327, 328, 332, 333, 334, 335, 336]",0.4186046511627907,0.5833333333333334,0.5833333333333334,0.5833333333333334,1.0,1.0,1.0,1.0,0.9285714285714286,1.0,1.0,1.0
4404,"Damn, a whole family. Sad indeed.","[[0, 3, 'Toxic']]",Damn  a whole family  Sad indeed ,"[0, 1, 2, 3]","[0, 1, 2, 3]","[0, 1, 2, 3]","[0, 1, 2, 3]","[0, 1, 2, 3]",1.0,1.0,1.0,1.0,1.0,1.0,1.0,1.0,1.0,1.0,1.0,1.0
4425,"where are all the comments screaming about racists and bigots? oh wait, this is a black dude shooting whiteys. never mind...","[[43, 49, 'Toxic'], [55, 60, 'Toxic'], [82, 91, 'Toxic'], [93, 100, 'Toxic'], [102, 108, 'Toxic']]",where are all the comments screaming about racists and bigots  oh wait  this is a black dude shooting whiteys  never mind   ,"[43, 44, 45, 46, 47, 48, 49, 55, 56, 57, 58, 59, 60, 82, 83, 84, 85, 86, 87, 88, 89, 90, 91, 93, 94, 95, 96, 97, 98, 99, 100, 101, 102, 103, 104, 105, 106, 107, 108]","[43, 44, 45, 46, 47, 48, 49, 82, 83, 84, 85, 86, 87, 88, 89, 90, 91]","[43, 44, 45, 46, 47, 48, 49, 93, 94, 95, 96, 97, 98, 99, 100]","[43, 44, 45, 46, 47, 48, 49, 55, 56, 57, 58, 59, 60, 82, 83, 84, 85, 86]","[43, 44, 45, 46, 47, 48, 49, 55, 56, 57, 58, 59, 60, 82, 83, 84, 85, 86, 87, 88, 89, 90, 91, 93, 94, 95, 96, 97, 98, 99, 100, 102, 103, 104, 105, 106, 107, 108]",0.987012987012987,0.6428571428571429,0.6181818181818182,0.5660377358490566,1.0,1.0,1.0,1.0,1.0,0.9285714285714286,1.0,0.9285714285714286
4426,I  take  great  comfort  in  being  proven  right  concerning  the  liars  and  buttsore  losers  of  the  corrupt  and  dishonest  LWM.,"[[90, 95, 'Toxic'], [107, 113, 'Toxic'], [121, 129, 'Toxic']]",I  take  great  comfort  in  being  proven  right  concerning  the  liars  and  buttsore  losers  of  the  corrupt  and  dishonest  LWM ,"[68, 69, 70, 71, 72]","[68, 69, 70, 71, 72, 80, 81, 82, 83, 84, 85, 86, 87, 90, 91, 92, 93, 94, 95]","[68, 69, 70, 71, 72, 90, 91, 92, 93, 94, 95]","[68, 69, 70, 71, 72, 80, 81, 82, 83, 84, 85, 86, 87]","[90, 91, 92, 93, 94, 95, 107, 108, 109, 110, 111, 112, 113, 121, 122, 123, 124, 125, 126, 127, 128, 129]",0.0,0.0,0.2926829268292683,0.3636363636363637,1.0,1.0,1.0,1.0,0.7857142857142857,1.0,1.0,1.0
4442,THen you are a fucking moron.,"[[15, 21, 'Toxic'], [23, 27, 'Toxic']]",THen you are a fucking moron ,"[15, 16, 17, 18, 19, 20, 21, 23, 24, 25, 26, 27]","[15, 16, 17, 18, 19, 20, 21, 23, 24, 25, 26, 27]","[15, 16, 17, 18, 19, 20, 21, 23, 24, 25, 26, 27]","[15, 16, 17, 18, 19, 20, 21, 23, 24, 25, 26, 27]","[15, 16, 17, 18, 19, 20, 21, 23, 24, 25, 26, 27]",1.0,1.0,1.0,1.0,1.0,1.0,1.0,1.0,1.0,1.0,1.0,1.0
4453,your post proves you are an idiot,"[[28, 32, 'Toxic']]",your post proves you are an idiot,"[28, 29, 30, 31, 32]","[28, 29, 30, 31, 32]","[28, 29, 30, 31, 32]","[28, 29, 30, 31, 32]","[28, 29, 30, 31, 32]",1.0,1.0,1.0,1.0,1.0,1.0,1.0,1.0,1.0,1.0,1.0,1.0
4463,Or the other idiot to suggest a used Toureg TDI.,"[[13, 17, 'Toxic']]",Or the other idiot to suggest a used Toureg TDI ,"[13, 14, 15, 16, 17]","[13, 14, 15, 16, 17]","[13, 14, 15, 16, 17]","[13, 14, 15, 16, 17]","[13, 14, 15, 16, 17]",1.0,1.0,1.0,1.0,1.0,1.0,1.0,1.0,1.0,1.0,1.0,1.0
4469,"Micciche has not one redeeming quality.
He's a lowlife lying scum.","[[47, 64, 'Toxic']]","Micciche has not one redeeming quality 
He s a lowlife lying scum ","[47, 48, 49, 50, 51, 52, 53, 54, 55, 56, 57, 58, 59, 61, 62, 63, 64]","[61, 62, 63, 64]","[61, 62, 63, 64]","[47, 48, 49, 50, 51, 52, 53, 61, 62, 63, 64]","[47, 48, 49, 50, 51, 52, 53, 54, 55, 56, 57, 58, 59, 60, 61, 62, 63, 64]",0.9714285714285714,0.7586206896551724,0.3636363636363637,0.3636363636363637,1.0,1.0,1.0,1.0,1.0,1.0,0.6428571428571429,0.6428571428571429
4477,Where was the liberal outcry when Mrs Obama's mother was paid to baby sit her grandchildren?  Once again the left shows it's hypocrisy!,"[[125, 133, 'Toxic']]",Where was the liberal outcry when Mrs Obama s mother was paid to baby sit her grandchildren   Once again the left shows it s hypocrisy ,"[125, 126, 127, 128, 129, 130, 131, 132, 133]","[125, 126, 127, 128, 129, 130, 131, 132, 133]","[125, 126, 127, 128, 129, 130, 131, 132, 133]","[125, 126, 127, 128, 129, 130, 131, 132, 133]","[125, 126, 127, 128, 129, 130, 131, 132, 133]",1.0,1.0,1.0,1.0,1.0,1.0,1.0,1.0,1.0,1.0,1.0,1.0
