id,text,labels,cleaned_text,bert_large_glove,bert_base_glove,bert_base,bert_large,ground,scores-bert_large_glove,scores-bert_large,scores-bert_base_glove,scores-bert_base,p_scores-bert_large_glove,p_scores-bert_large,p_scores-bert_base_glove,p_scores-bert_base,r_scores-bert_large_glove,r_scores-bert_large,r_scores-bert_base_glove,r_scores-bert_base
2857,Castrate this guy.,"[[0, 16, 'Toxic']]",Castrate this guy ,"[0, 1, 2, 3, 4, 5, 6, 7, 8, 9, 10, 11, 12, 13, 14, 15, 16]","[0, 1, 2, 3, 4, 5, 6, 7, 8, 9, 10, 11, 12]","[0, 1, 2, 3, 4, 5, 6, 7, 8, 9, 10, 11, 12, 13, 14, 15, 16]","[0, 1, 2, 3, 4, 5, 6, 7, 14, 15, 16]","[0, 1, 2, 3, 4, 5, 6, 7, 8, 9, 10, 11, 12, 13, 14, 15, 16]",1.0,0.7857142857142857,0.8666666666666667,1.0,1.0,1.0,1.0,1.0,1.0,0.8571428571428571,1.0,1.0
2861,"She was a crook then, she is a crook now.","[[10, 14, 'Toxic']]",She was a crook then  she is a crook now ,"[10, 11, 12, 13, 14, 31, 32, 33, 34, 35]","[10, 11, 12, 13, 14, 31, 32, 33, 34, 35]","[10, 11, 12, 13, 14, 31, 32, 33, 34, 35]","[10, 11, 12, 13, 14, 31, 32, 33, 34, 35]","[10, 11, 12, 13, 14]",0.6666666666666666,0.6666666666666666,0.6666666666666666,0.6666666666666666,0.9,0.9,0.9,0.9,1.0,1.0,1.0,1.0
2872,"""John Kelly, Trumpâ€™s new chief of staff, wonâ€™t suffer idiots and foolsâ€... Well I guess this means Kelly won't be doing any interviews with ""reporters"" from the Washington Post or by extension, their little minion, the Denver Post.","[[1, 69, 'Toxic']]", John Kelly  Trump s new chief of staff  won t suffer idiots and fools     Well I guess this means Kelly won t be doing any interviews with  reporters  from the Washington Post or by extension  their little minion  the Denver Post ,"[54, 55, 56, 57, 58, 59, 65, 66, 67, 68, 69]","[54, 55, 56, 57, 58, 59, 65, 66, 67, 68, 69]","[54, 55, 56, 57, 58, 59, 65, 66, 67, 68, 69]","[54, 55, 56, 57, 58, 59, 65, 66, 67, 68, 69]","[1, 2, 3, 4, 5, 6, 7, 8, 9, 10, 11, 12, 13, 14, 15, 16, 17, 18, 19, 20, 21, 22, 23, 24, 25, 26, 27, 28, 29, 30, 31, 32, 33, 34, 35, 36, 37, 38, 39, 40, 41, 42, 43, 44, 45, 46, 47, 48, 49, 50, 51, 52, 53, 54, 55, 56, 57, 58, 59, 60, 61, 62, 63, 64, 65, 66, 67, 68, 69]",0.275,0.275,0.275,0.275,1.0,1.0,1.0,1.0,0.7142857142857143,0.7142857142857143,0.7142857142857143,0.7142857142857143
2908,"Morneau is correct he doesn't ""report"" to journalists about his personal situation, but as a public official (one of the highest in the land) he had better be prepared to answer their questions, both pleasant and otherwise. The free press is the final backstop of democracy in this country and Morneau did sign on to the democratic process and all it entails when he answered Trudeau's call to serve. So, stop whining and sounding so damn Trump-like, face the music, be a man and do the right thing.","[[256, 262, 'Toxic'], [434, 437, 'Toxic']]",Morneau is correct he doesn t  report  to journalists about his personal situation  but as a public official  one of the highest in the land  he had better be prepared to answer their questions  both pleasant and otherwise  The free press is the final backstop of democracy in this country and Morneau did sign on to the democratic process and all it entails when he answered Trudeau s call to serve  So  stop whining and sounding so damn Trump like  face the music  be a man and do the right thing ,"[434, 435, 436, 437]","[434, 435, 436, 437]","[434, 435, 436, 437]","[434, 435, 436, 437]","[256, 257, 258, 259, 260, 261, 262, 434, 435, 436, 437]",0.5333333333333333,0.5333333333333333,0.5333333333333333,0.5333333333333333,1.0,1.0,1.0,1.0,0.6428571428571429,0.6428571428571429,0.6428571428571429,0.6428571428571429
2915,Good practice for my ruger 22. Shoot the pest and toss it in the dumpster,"[[65, 72, 'Toxic']]",Good practice for my ruger 22  Shoot the pest and toss it in the dumpster,"[31, 32, 33, 34, 35, 36, 37, 38, 39, 41, 42, 43, 44, 65, 66, 67, 68, 69, 70, 71, 72]","[31, 32, 33, 34, 35, 36, 37, 38, 39, 40, 41, 42, 43, 44]","[41, 42, 43, 44]","[41, 42, 43, 44]","[65, 66, 67, 68, 69, 70, 71, 72]",0.5517241379310345,0.0,0.0,0.0,0.8571428571428571,0.75,0.8571428571428571,0.75,1.0,0.5,1.0,0.5
2947,Shut up and GO TO HELL,"[[12, 21, 'Toxic']]",Shut up and GO TO HELL,"[0, 1, 2, 3, 4, 5, 6, 18, 19, 20, 21]","[18, 19, 20, 21]","[18, 19, 20, 21]","[18, 19, 20, 21]","[12, 13, 14, 15, 16, 17, 18, 19, 20, 21]",0.3809523809523809,0.5714285714285714,0.5714285714285714,0.5714285714285714,1.0,1.0,1.0,1.0,0.9285714285714286,0.6428571428571429,0.6428571428571429,0.6428571428571429
2959,What an idiotic article.,"[[8, 14, 'Toxic']]",What an idiotic article ,"[8, 9, 10, 11, 12, 13, 14]","[8, 9, 10, 11, 12, 13, 14]","[8, 9, 10, 11, 12, 13, 14]","[8, 9, 10, 11, 12, 13, 14]","[8, 9, 10, 11, 12, 13, 14]",1.0,1.0,1.0,1.0,1.0,1.0,1.0,1.0,1.0,1.0,1.0,1.0
2968,"By her own logic one might surmise she's either here temporarily for the sole purpose of defending native Canadian rights and nothing else or she should dispose of everything she owns and leave the country so it can be reacquired by natives. Since neither is likely true she's just a common hypocrite with a racist streak. And she's always welcome to move somewhere more to her liking where there are less white people, except of course no one anywhere in the world is moving in that direction. More hypocrisy.","[[291, 299, 'Toxic']]",By her own logic one might surmise she s either here temporarily for the sole purpose of defending native Canadian rights and nothing else or she should dispose of everything she owns and leave the country so it can be reacquired by natives  Since neither is likely true she s just a common hypocrite with a racist streak  And she s always welcome to move somewhere more to her liking where there are less white people  except of course no one anywhere in the world is moving in that direction  More hypocrisy ,"[291, 292, 293, 294, 295, 296, 297, 298, 299, 500, 501, 502, 503, 504, 505, 506, 507, 508]","[291, 292, 293, 294, 295, 296, 297, 298, 299, 500, 501, 502, 503, 504, 505, 506, 507, 508]","[291, 292, 293, 294, 295, 296, 297, 298, 299, 500, 501, 502, 503, 504, 505, 506, 507, 508]","[291, 292, 293, 294, 295, 296, 297, 298, 299, 500, 501, 502, 503, 504, 505, 506, 507, 508]","[291, 292, 293, 294, 295, 296, 297, 298, 299]",0.6666666666666666,0.6666666666666666,0.6666666666666666,0.6666666666666666,0.9285714285714286,0.9285714285714286,0.9285714285714286,0.9285714285714286,1.0,1.0,1.0,1.0
2973,The treasonous seditious protesting anti American commie fag cant accept the outcome of the election so he likens the president to adolph hitler its his own partys fault they lost total loser. Canada awaits you. Suck it.,"[[212, 218, 'Toxic']]",The treasonous seditious protesting anti American commie fag cant accept the outcome of the election so he likens the president to adolph hitler its his own partys fault they lost total loser  Canada awaits you  Suck it ,"[212, 213, 214, 215, 216, 217, 218]","[212, 213, 214, 215]","[212, 213, 214, 215]","[212, 213, 214, 215]","[212, 213, 214, 215, 216, 217, 218]",1.0,0.7272727272727273,0.7272727272727273,0.7272727272727273,1.0,1.0,1.0,1.0,1.0,0.75,0.75,0.75
2978,Obama is a bitter racist idiot .Snow flakes are really starting to piss me off with lies and more lies . Media is the worst including CBC,"[[25, 29, 'Toxic']]",Obama is a bitter racist idiot  Snow flakes are really starting to piss me off with lies and more lies   Media is the worst including CBC,"[18, 19, 20, 21, 22, 23, 25, 26, 27, 28, 29]","[25, 26, 27, 28, 29]","[25, 26, 27, 28, 29]","[25, 26, 27, 28, 29]","[25, 26, 27, 28, 29]",0.625,1.0,1.0,1.0,0.7692307692307693,1.0,1.0,1.0,1.0,1.0,1.0,1.0
2998,Sounds like they were living like pigs! Were they not individually responsible to make sure that the fire escapes were clear.,"[[0, 37, 'Toxic']]",Sounds like they were living like pigs  Were they not individually responsible to make sure that the fire escapes were clear ,"[34, 35, 36, 37]","[34, 35, 36, 37]","[34, 35, 36, 37]","[34, 35, 36, 37]","[0, 1, 2, 3, 4, 5, 6, 7, 8, 9, 10, 11, 12, 13, 14, 15, 16, 17, 18, 19, 20, 21, 22, 23, 24, 25, 26, 27, 28, 29, 30, 31, 32, 33, 34, 35, 36, 37]",0.19047619047619047,0.19047619047619047,0.19047619047619047,0.19047619047619047,1.0,1.0,1.0,1.0,0.6428571428571429,0.6428571428571429,0.6428571428571429,0.6428571428571429
2999,You sure are some real losers up in Alaska,"[[23, 28, 'Toxic']]",You sure are some real losers up in Alaska,"[23, 24, 25, 26, 27, 28]","[23, 24, 25, 26, 27, 28]","[23, 24, 25, 26, 27, 28]","[23, 24, 25, 26, 27, 28]","[23, 24, 25, 26, 27, 28]",1.0,1.0,1.0,1.0,1.0,1.0,1.0,1.0,1.0,1.0,1.0,1.0
3006,Agragiiq ignore FB and all the other IGNORANT people. Good Job hold your head high!,"[[37, 44, 'Toxic']]",Agragiiq ignore FB and all the other IGNORANT people  Good Job hold your head high ,"[37, 38, 39, 40, 41, 42, 43, 44]","[37, 38, 39, 40, 41, 42, 43, 44]","[37, 38, 39, 40, 41, 42, 43, 44]","[37, 38, 39, 40, 41, 42, 43, 44]","[37, 38, 39, 40, 41, 42, 43, 44]",1.0,1.0,1.0,1.0,1.0,1.0,1.0,1.0,1.0,1.0,1.0,1.0
3023,"Didn't Donny promote his sister to the politburo?  Wait, that was Kim Jong...sorry, I get these two clowns and their clans mixed up.","[[100, 105, 'Toxic']]",Didn t Donny promote his sister to the politburo   Wait  that was Kim Jong   sorry  I get these two clowns and their clans mixed up ,"[100, 101, 102, 103, 104, 105]","[100, 101, 102, 103, 104, 105]","[100, 101, 102, 103, 104, 105]","[100, 101, 102, 103, 104, 105]","[100, 101, 102, 103, 104, 105]",1.0,1.0,1.0,1.0,1.0,1.0,1.0,1.0,1.0,1.0,1.0,1.0
3024,"Hey Seaton- ever hear of keeping schools up to code so they don't get sued? Naw, didn't think so. 

Thank you for underscoring what is wrong with you freakin' legislators down in JNU; stellar example.","[[150, 156, 'Toxic']]","Hey Seaton  ever hear of keeping schools up to code so they don t get sued  Naw  didn t think so  

Thank you for underscoring what is wrong with you freakin  legislators down in JNU  stellar example ","[150, 151, 152, 153, 154, 155, 156]","[150, 151, 152, 153, 154, 155, 156]","[150, 151, 152, 153, 154, 155, 156]","[150, 151, 152, 153, 154, 155, 156]","[150, 151, 152, 153, 154, 155, 156]",1.0,1.0,1.0,1.0,1.0,1.0,1.0,1.0,1.0,1.0,1.0,1.0
3033,You can if you are a moron.,"[[21, 25, 'Toxic']]",You can if you are a moron ,"[21, 22, 23, 24, 25]","[21, 22, 23, 24, 25]","[21, 22, 23, 24, 25]","[21, 22, 23, 24, 25]","[21, 22, 23, 24, 25]",1.0,1.0,1.0,1.0,1.0,1.0,1.0,1.0,1.0,1.0,1.0,1.0
3036,"Good article.........
And since I am a genius...anybody who does not agree is a moron.","[[80, 84, 'Toxic']]","Good article         
And since I am a genius   anybody who does not agree is a moron ","[80, 81, 82, 83, 84]","[80, 81, 82, 83, 84]","[80, 81, 82, 83, 84]","[80, 81, 82, 83, 84]","[80, 81, 82, 83, 84]",1.0,1.0,1.0,1.0,1.0,1.0,1.0,1.0,1.0,1.0,1.0,1.0
3037,"So did you favor slavery staying intact a policy in the US too, or did you recognize that things can actually change warranting a change in policy?

In the 1700's and 1800's, the US was adding vast frontier land mass that needed populating.  We haven't added land mass to the US in over a century, yet we keep importing population by the millions every decade.  The US population in 1900 was 76 million.  Today it's 325 million, and soaring.

Stupidly not adjusting immigration quotas to reflect those dramatically different realities is, well, stupid.","[[545, 550, 'Toxic']]","So did you favor slavery staying intact a policy in the US too  or did you recognize that things can actually change warranting a change in policy 

In the 1700 s and 1800 s  the US was adding vast frontier land mass that needed populating   We haven t added land mass to the US in over a century  yet we keep importing population by the millions every decade   The US population in 1900 was 76 million   Today it s 325 million  and soaring 

Stupidly not adjusting immigration quotas to reflect those dramatically different realities is  well  stupid ","[443, 444, 445, 446, 447, 448, 449, 450, 545, 546, 547, 548, 549, 550]","[443, 444, 445, 446, 447, 448, 449, 450, 545, 546, 547, 548, 549, 550]","[443, 444, 445, 446, 447, 448, 449, 450, 545, 546, 547, 548, 549, 550]","[443, 444, 445, 446, 447, 448, 449, 450, 545, 546, 547, 548, 549, 550]","[545, 546, 547, 548, 549, 550]",0.6,0.6,0.6,0.6,0.9166666666666666,0.9166666666666666,0.9166666666666666,0.9166666666666666,1.0,1.0,1.0,1.0
3043,Are they ALL idiots?,"[[13, 18, 'Toxic']]",Are they ALL idiots ,"[13, 14, 15, 16, 17, 18]","[13, 14, 15, 16, 17, 18]","[13, 14, 15, 16, 17, 18]","[13, 14, 15, 16, 17, 18]","[13, 14, 15, 16, 17, 18]",1.0,1.0,1.0,1.0,1.0,1.0,1.0,1.0,1.0,1.0,1.0,1.0
3063,How sad and pathetic that there are individuals out there that have nothing better to do. Good for them that I'm sure their souls are being prayed for (generously) AND bad for them--go for the DNA. I'm sure one of the idiots wore the cap!,"[[218, 223, 'Toxic']]",How sad and pathetic that there are individuals out there that have nothing better to do  Good for them that I m sure their souls are being prayed for  generously  AND bad for them  go for the DNA  I m sure one of the idiots wore the cap ,"[12, 13, 14, 15, 16, 17, 18, 19, 218, 219, 220, 221, 222, 223]","[12, 13, 14, 15, 16, 17, 18, 19, 218, 219, 220, 221, 222, 223]","[12, 13, 14, 15, 16, 17, 18, 19, 218, 219, 220, 221, 222, 223]","[12, 13, 14, 15, 16, 17, 18, 19, 218, 219, 220, 221, 222, 223]","[218, 219, 220, 221, 222, 223]",0.6,0.6,0.6,0.6,0.7142857142857143,0.7142857142857143,0.7142857142857143,0.7142857142857143,1.0,1.0,1.0,1.0
3067,"â€œWe all lose?â€, Donâ€™t think so, donâ€™t include me in with you losers, lol","[[61, 66, 'Toxic']]", We all lose    Don t think so  don t include me in with you losers  lol,"[61, 62, 63, 64, 65, 66]","[61, 62, 63, 64, 65, 66]","[61, 62, 63, 64, 65, 66]","[61, 62, 63, 64, 65, 66]","[61, 62, 63, 64, 65, 66]",1.0,1.0,1.0,1.0,1.0,1.0,1.0,1.0,1.0,1.0,1.0,1.0
3069,Who is stupid enough to eat a lobster that big? The meat would be pretty tough!,"[[7, 12, 'Toxic']]",Who is stupid enough to eat a lobster that big  The meat would be pretty tough ,"[7, 8, 9, 10, 11, 12]","[7, 8, 9, 10, 11, 12]","[7, 8, 9, 10, 11, 12]","[7, 8, 9, 10, 11, 12]","[7, 8, 9, 10, 11, 12]",1.0,1.0,1.0,1.0,1.0,1.0,1.0,1.0,1.0,1.0,1.0,1.0
3078,April fools!  This is a joke right? You are supposed to at least pretend you're not completely inept and corrupt. SMH,"[[95, 111, 'Toxic']]",April fools   This is a joke right  You are supposed to at least pretend you re not completely inept and corrupt  SMH,"[6, 7, 8, 9, 10]","[6, 7, 8, 9, 10]","[6, 7, 8, 9, 10]","[6, 7, 8, 9, 10, 105, 106, 107, 108, 109, 110, 111]","[95, 96, 97, 98, 99, 100, 101, 102, 103, 104, 105, 106, 107, 108, 109, 110, 111]",0.0,0.4827586206896552,0.0,0.0,1.0,1.0,1.0,1.0,0.7142857142857143,0.7857142857142857,0.7142857142857143,0.7142857142857143
3088,"hey stupid, price took charter flights since May, costing $400,000 and to travel from DC to Philadelphia, which could go faster by train.","[[4, 9, 'Toxic']]",hey stupid  price took charter flights since May  costing  400 000 and to travel from DC to Philadelphia  which could go faster by train ,"[4, 5, 6, 7, 8, 9]","[4, 5, 6, 7, 8, 9]","[4, 5, 6, 7, 8, 9]","[4, 5, 6, 7, 8, 9]","[4, 5, 6, 7, 8, 9]",1.0,1.0,1.0,1.0,1.0,1.0,1.0,1.0,1.0,1.0,1.0,1.0
3108,Once again the left is hoping the masses are too stupid to both read and comprehend the sources they point to.,"[[49, 54, 'Toxic']]",Once again the left is hoping the masses are too stupid to both read and comprehend the sources they point to ,"[49, 50, 51, 52, 53, 54]","[49, 50, 51, 52, 53, 54]","[49, 50, 51, 52, 53, 54]","[49, 50, 51, 52, 53, 54]","[49, 50, 51, 52, 53, 54]",1.0,1.0,1.0,1.0,1.0,1.0,1.0,1.0,1.0,1.0,1.0,1.0
3113,"Decades ago, Ted Stevens standing in the clown tent that is the Alaska Legislature, told the fools in Juneau that unless they did something to align state law with federal law the state was going to lose control of game management on federal lands. The clowns said, ""No."" 

Maybe when Dumb Dumb Donald is POTUS he will build a wall or something...","[[41, 45, 'Toxic'], [93, 97, 'Toxic'], [305, 309, 'Toxic']]","Decades ago  Ted Stevens standing in the clown tent that is the Alaska Legislature  told the fools in Juneau that unless they did something to align state law with federal law the state was going to lose control of game management on federal lands  The clowns said   No   

Maybe when Dumb Dumb Donald is POTUS he will build a wall or something   ","[93, 94, 95, 96, 97]","[41, 42, 43, 44, 45, 93, 94, 95, 96, 97, 285, 286, 287, 288, 290, 291, 292, 293]","[93, 94, 95, 96, 97, 285, 286, 287, 288, 290, 291, 292, 293]","[93, 94, 95, 96, 97, 285, 286, 287, 288, 290, 291, 292, 293]","[41, 42, 43, 44, 45, 93, 94, 95, 96, 97, 305, 306, 307, 308, 309]",0.5,0.35714285714285715,0.6060606060606061,0.35714285714285715,1.0,1.0,1.0,1.0,0.7142857142857143,1.0,1.0,1.0
3114,"Please!  We no longer refer to them as ""clowns.""  We now say ""humorous Americans.""

Remember, humorous Americans are people too.","[[40, 45, 'Toxic']]","Please   We no longer refer to them as  clowns    We now say  humorous Americans  

Remember  humorous Americans are people too ","[40, 41, 42, 43, 44, 45]","[40, 41, 42, 43, 44, 45]","[40, 41, 42, 43, 44, 45]","[40, 41, 42, 43, 44, 45]","[40, 41, 42, 43, 44, 45]",1.0,1.0,1.0,1.0,1.0,1.0,1.0,1.0,1.0,1.0,1.0,1.0
3118,"you are an idiot,, tell us loser what has he done that warrents that fantasy","[[11, 15, 'Toxic']]",you are an idiot   tell us loser what has he done that warrents that fantasy,"[11, 12, 13, 14, 15, 27, 28, 29, 30, 31]","[11, 12, 13, 14, 15, 27, 28, 29, 30, 31]","[11, 12, 13, 14, 15]","[11, 12, 13, 14, 15, 27, 28, 29, 30, 31]","[11, 12, 13, 14, 15]",0.6666666666666666,0.6666666666666666,0.6666666666666666,1.0,0.6923076923076923,0.6923076923076923,0.6923076923076923,1.0,1.0,1.0,1.0,1.0
3139,This whole damn thing stinks of resentment... and we know where stink starts...,"[[11, 14, 'Toxic']]",This whole damn thing stinks of resentment    and we know where stink starts   ,"[11, 12, 13, 14]","[11, 12, 13, 14]","[11, 12, 13, 14]","[11, 12, 13, 14, 64, 65, 66, 67, 68]","[11, 12, 13, 14]",1.0,0.6153846153846154,1.0,1.0,1.0,0.6666666666666666,1.0,1.0,1.0,1.0,1.0,1.0
3157,"That's it.  Take the whole damn thing down with you, Francois.","[[27, 30, 'Toxic']]",That s it   Take the whole damn thing down with you  Francois ,"[27, 28, 29, 30]","[27, 28, 29, 30]","[27, 28, 29, 30]","[27, 28, 29, 30]","[27, 28, 29, 30]",1.0,1.0,1.0,1.0,1.0,1.0,1.0,1.0,1.0,1.0,1.0,1.0
3171,"A perfect post ... accurate, succinct and (best of all) it ends/closes with a reasonable proposal to deal with this obvious cluster-fuck.","[[124, 135, 'Toxic']]",A perfect post     accurate  succinct and  best of all  it ends closes with a reasonable proposal to deal with this obvious cluster fuck ,"[132, 133, 134, 135]","[132, 133, 134, 135]","[132, 133, 134, 135]","[124, 125, 126, 127, 128, 129, 130, 132, 133, 134, 135]","[124, 125, 126, 127, 128, 129, 130, 131, 132, 133, 134, 135]",0.5,0.9565217391304348,0.5,0.5,1.0,1.0,1.0,1.0,0.6428571428571429,1.0,0.6428571428571429,0.6428571428571429
3187,"I've never seen Anchorage so violent like it is now, it's gotten so progressively rotten since the pipeline. I curse that damn pipeline! More people, more crime. Just the way it is. I miss Anchorage the way it used to be. Those days are gone forever, we will never have it back. My heartfelt condolences for all those who lost loved ones this week/year to such senseless violence.","[[111, 115, 'Toxic']]",I ve never seen Anchorage so violent like it is now  it s gotten so progressively rotten since the pipeline  I curse that damn pipeline  More people  more crime  Just the way it is  I miss Anchorage the way it used to be  Those days are gone forever  we will never have it back  My heartfelt condolences for all those who lost loved ones this week year to such senseless violence ,"[122, 123, 124, 125]","[122, 123, 124, 125]","[122, 123, 124, 125]","[122, 123, 124, 125]","[111, 112, 113, 114, 115]",0.0,0.0,0.0,0.0,1.0,1.0,1.0,1.0,1.0,1.0,1.0,1.0
3218,"One must wonder what the reasoning ability is of a person who believes that the funds providing a subsidy for those with disabilities were the result of the ACA and that people with disabilities received little or no assistance from Medicaid prior to the law being enacted.  The term ""useful idiots"" springs to mind.","[[292, 297, 'Toxic']]",One must wonder what the reasoning ability is of a person who believes that the funds providing a subsidy for those with disabilities were the result of the ACA and that people with disabilities received little or no assistance from Medicaid prior to the law being enacted   The term  useful idiots  springs to mind ,"[292, 293, 294, 295, 296, 297]","[292, 293, 294, 295, 296, 297]","[292, 293, 294, 295, 296, 297]","[292, 293, 294, 295, 296, 297]","[292, 293, 294, 295, 296, 297]",1.0,1.0,1.0,1.0,1.0,1.0,1.0,1.0,1.0,1.0,1.0,1.0
3231,Good thing for someone who needs to put in some community service- round them up and burn them.,"[[67, 93, 'Toxic']]",Good thing for someone who needs to put in some community service  round them up and burn them ,"[85, 86, 87, 88, 89, 90, 91, 92, 93]","[85, 86, 87, 88]","[85, 86, 87, 88]","[85, 86, 87, 88]","[67, 68, 69, 70, 71, 72, 73, 74, 75, 76, 77, 78, 79, 80, 81, 82, 83, 84, 85, 86, 87, 88, 89, 90, 91, 92, 93]",0.5,0.25806451612903225,0.25806451612903225,0.25806451612903225,1.0,1.0,1.0,1.0,0.9285714285714286,0.5714285714285714,0.5714285714285714,0.5714285714285714
3233,Gonna get yo arse kicked when u re-enter the USA. Stupid mouth. Ya drink and drug too much. See what happened to that silly lesbo with the unbridled mouth. Now no job and no jigs. No more New Year's celebration. Maybe u no mo movies.,"[[50, 55, 'Toxic']]",Gonna get yo arse kicked when u re enter the USA  Stupid mouth  Ya drink and drug too much  See what happened to that silly lesbo with the unbridled mouth  Now no job and no jigs  No more New Year s celebration  Maybe u no mo movies ,"[13, 14, 15, 16, 17, 18, 19, 20, 21, 22, 23, 50, 51, 52, 53, 54, 55]","[13, 14, 15, 16, 50, 51, 52, 53, 54, 55, 118, 119, 120, 121, 122]","[13, 14, 15, 16, 50, 51, 52, 53, 54, 55, 118, 119, 120, 121, 122]","[13, 14, 15, 16, 50, 51, 52, 53, 54, 55]","[50, 51, 52, 53, 54, 55]",0.5217391304347826,0.75,0.5714285714285714,0.5714285714285714,0.7142857142857143,0.9090909090909091,0.7692307692307693,0.7692307692307693,1.0,1.0,1.0,1.0
3246,"John Kerry has always been an incompetent fool. He let his daughter marry a Muslim, then brokered the sweetheart anti-American nuclear deal for Iran, effectively treason. He never did anything good for the country, and was branded an incompetent coward even in Viet Nam. He was a perfect moron's puppet as Sec of State, and should be left in disgrace. His opinion is never needed.","[[42, 45, 'Toxic']]",John Kerry has always been an incompetent fool  He let his daughter marry a Muslim  then brokered the sweetheart anti American nuclear deal for Iran  effectively treason  He never did anything good for the country  and was branded an incompetent coward even in Viet Nam  He was a perfect moron s puppet as Sec of State  and should be left in disgrace  His opinion is never needed ,"[30, 31, 32, 33, 34, 35, 36, 37, 38, 39, 40, 42, 43, 44, 45, 288, 289, 290, 291, 292]","[30, 31, 32, 33, 34, 35, 36, 37, 38, 39, 40, 42, 43, 44, 45, 288, 289, 290, 291, 292]","[42, 43, 44, 45, 288, 289, 290, 291, 292]","[42, 43, 44, 45, 288, 289, 290, 291, 292]","[42, 43, 44, 45]",0.3333333333333333,0.6153846153846154,0.3333333333333333,0.6153846153846154,0.5714285714285714,0.6666666666666666,0.5714285714285714,0.6666666666666666,1.0,1.0,1.0,1.0
3247,Probably have families and lives. Enjoying this Sunday not spending every waking hour worrying about another countries problems or lack thereof.  Maybe pondering our own countries serious economic issues which seem to get pushed aside  for another trump bashing article that is quickly becoming obvious and kind of boring. Well back to enjoying the Sunday. Later losers!!!,"[[363, 368, 'Toxic']]",Probably have families and lives  Enjoying this Sunday not spending every waking hour worrying about another countries problems or lack thereof   Maybe pondering our own countries serious economic issues which seem to get pushed aside  for another trump bashing article that is quickly becoming obvious and kind of boring  Well back to enjoying the Sunday  Later losers   ,"[363, 364, 365, 366, 367, 368]","[363, 364, 365, 366, 367, 368]","[363, 364, 365, 366, 367, 368]","[363, 364, 365, 366, 367, 368]","[363, 364, 365, 366, 367, 368]",1.0,1.0,1.0,1.0,1.0,1.0,1.0,1.0,1.0,1.0,1.0,1.0
