id,text,labels,cleaned_text,bert_large_glove,bert_base_glove,bert_base,bert_large,ground,scores-bert_large_glove,scores-bert_large,scores-bert_base_glove,scores-bert_base,p_scores-bert_large_glove,p_scores-bert_large,p_scores-bert_base_glove,p_scores-bert_base,r_scores-bert_large_glove,r_scores-bert_large,r_scores-bert_base_glove,r_scores-bert_base
1426,"This is the kind of platitude needs to stop.  Sometimes these weak kneed non-leaders need to grow some ""steel balls"" and side with data.  Sure, it would be nice to have ""everyone"" to serve.. kids, elders, gays, trannies, dogs, cats.. why not?  Losers..  Side with data!","[[62, 65, 'Toxic'], [205, 224, 'Toxic'], [244, 249, 'Toxic']]",This is the kind of platitude needs to stop   Sometimes these weak kneed non leaders need to grow some  steel balls  and side with data   Sure  it would be nice to have  everyone  to serve   kids  elders  gays  trannies  dogs  cats   why not   Losers    Side with data ,"[244, 245, 246, 247, 248, 249]","[205, 206, 207, 208, 211, 212, 213, 214, 215, 216, 217, 218, 219, 220, 221, 222, 223, 224, 244, 245, 246, 247, 248, 249]","[205, 206, 207, 208, 244, 245, 246, 247, 248, 249]","[205, 206, 207, 208, 244, 245, 246, 247, 248, 249]","[62, 63, 64, 65, 205, 206, 207, 208, 209, 210, 211, 212, 213, 214, 215, 216, 217, 218, 219, 220, 221, 222, 223, 224, 244, 245, 246, 247, 248, 249]",0.3333333333333333,0.5,0.8888888888888888,0.5,1.0,1.0,1.0,1.0,0.7857142857142857,0.8571428571428571,1.0,0.8571428571428571
1445,Who do we thank for your stupidity?  Your parents?,"[[25, 33, 'Toxic']]",Who do we thank for your stupidity   Your parents ,"[25, 26, 27, 28, 29, 30, 31, 32, 33]","[25, 26, 27, 28, 29, 30, 31, 32, 33]","[25, 26, 27, 28, 29, 30, 31, 32, 33]","[25, 26, 27, 28, 29, 30, 31, 32, 33]","[25, 26, 27, 28, 29, 30, 31, 32, 33]",1.0,1.0,1.0,1.0,1.0,1.0,1.0,1.0,1.0,1.0,1.0,1.0
1455,"Another Alaska Gov't clownshow... worthless investigators don't do crap.
I know many people have complained about real estate sales people in Homer area, and nothing was ever done.
Same people still ripping off consumers with thier crooked ways...","[[34, 70, 'Toxic']]","Another Alaska Gov t clownshow    worthless investigators don t do crap 
I know many people have complained about real estate sales people in Homer area  and nothing was ever done 
Same people still ripping off consumers with thier crooked ways   ","[21, 22, 23, 24, 25, 26, 27, 28, 29, 30, 31, 32, 33, 34, 35, 36, 37, 38, 39, 40, 41, 42, 67, 68, 69, 70]","[21, 22, 23, 24, 25, 26, 27, 28, 29, 34, 35, 36, 37, 38, 39, 40, 41, 42, 67, 68, 69, 70]","[34, 35, 36, 37, 38, 39, 40, 41, 42, 67, 68, 69, 70]","[21, 22, 23, 24, 25, 26, 27, 28, 29, 34, 35, 36, 37, 38, 39, 40, 41, 42, 67, 68, 69, 70]","[34, 35, 36, 37, 38, 39, 40, 41, 42, 43, 44, 45, 46, 47, 48, 49, 50, 51, 52, 53, 54, 55, 56, 57, 58, 59, 60, 61, 62, 63, 64, 65, 66, 67, 68, 69, 70]",0.4126984126984127,0.4406779661016949,0.4406779661016949,0.52,1.0,1.0,1.0,1.0,1.0,1.0,1.0,1.0
1462,"aapoor  lefty, thinks its not blind when the decision does not go your way,, Keep crying loser","[[89, 93, 'Toxic']]",aapoor  lefty  thinks its not blind when the decision does not go your way   Keep crying loser,"[89, 90, 91, 92, 93]","[89, 90, 91, 92, 93]","[89, 90, 91, 92, 93]","[89, 90, 91, 92, 93]","[89, 90, 91, 92, 93]",1.0,1.0,1.0,1.0,1.0,1.0,1.0,1.0,1.0,1.0,1.0,1.0
1466,"Glenn, why are you such a fool. Grow up!","[[26, 29, 'Toxic']]",Glenn  why are you such a fool  Grow up ,"[26, 27, 28, 29]","[26, 27, 28, 29]","[26, 27, 28, 29]","[26, 27, 28, 29]","[26, 27, 28, 29]",1.0,1.0,1.0,1.0,1.0,1.0,1.0,1.0,1.0,1.0,1.0,1.0
1469,"Fat elephants like you constantly flap their mouths but do nothing of substance except take shots at everyone.  Most people, like you, are  pure cowards but the minute something happens personally to you, all the rhetoric and righteous stances go out the door as you start crying and calling the police, who you despise, for help to save your sorry arse.  faux u coward!  LOL!!!","[[145, 151, 'Toxic'], [363, 368, 'Toxic']]",Fat elephants like you constantly flap their mouths but do nothing of substance except take shots at everyone   Most people  like you  are  pure cowards but the minute something happens personally to you  all the rhetoric and righteous stances go out the door as you start crying and calling the police  who you despise  for help to save your sorry arse   faux u coward   LOL   ,"[349, 350, 351, 352]","[145, 146, 147, 148, 149, 150, 151, 363, 364, 365, 366, 367, 368]",[],"[145, 146, 147, 148, 149, 150, 151, 349, 350, 351, 352, 363, 364, 365, 366, 367, 368]","[145, 146, 147, 148, 149, 150, 151, 363, 364, 365, 366, 367, 368]",0.0,0.8666666666666667,1.0,0.0,0.9090909090909091,0.9285714285714286,1.0,1.0,0.7692307692307693,1.0,1.0,0.15384615384615385
1507,"This plan is stupid.  No thinking person, especially no thinking traveler would think this plan is anything aside from stupid.  Therefore, Denver will do it, and it will cost twice as much as planned (just like the airport did), and it will be worse.   Because, that's the way Denver rolls.","[[13, 18, 'Toxic'], [119, 124, 'Toxic']]",This plan is stupid   No thinking person  especially no thinking traveler would think this plan is anything aside from stupid   Therefore  Denver will do it  and it will cost twice as much as planned  just like the airport did   and it will be worse    Because  that s the way Denver rolls ,"[13, 14, 15, 16, 17, 18, 119, 120, 121, 122, 123, 124]","[13, 14, 15, 16, 17, 18, 119, 120, 121, 122, 123, 124]","[13, 14, 15, 16, 17, 18, 119, 120, 121, 122, 123, 124]","[13, 14, 15, 16, 17, 18, 119, 120, 121, 122, 123, 124]","[13, 14, 15, 16, 17, 18, 119, 120, 121, 122, 123, 124]",1.0,1.0,1.0,1.0,1.0,1.0,1.0,1.0,1.0,1.0,1.0,1.0
1521,"Douglas Bruce has to be the most pathetic ""person"" to have ever lived.","[[33, 40, 'Toxic']]",Douglas Bruce has to be the most pathetic  person  to have ever lived ,"[33, 34, 35, 36, 37, 38, 39, 40]","[33, 34, 35, 36, 37, 38, 39, 40]","[33, 34, 35, 36, 37, 38, 39, 40]","[33, 34, 35, 36, 37, 38, 39, 40]","[33, 34, 35, 36, 37, 38, 39, 40]",1.0,1.0,1.0,1.0,1.0,1.0,1.0,1.0,1.0,1.0,1.0,1.0
1526,"O my freaken gawd...way better than the sack of cellulite stuffed in a $12000 
Armani potato sack that Ivanka's father ran against...","[[40, 64, 'Toxic']]","O my freaken gawd   way better than the sack of cellulite stuffed in a  12000 
Armani potato sack that Ivanka s father ran against   ","[5, 6, 7, 8, 9, 10, 11, 12, 13, 14, 15, 16]","[5, 6, 7, 8, 9, 10, 11]","[5, 6, 7, 8, 9, 10, 11]","[5, 6, 7, 8, 9, 10, 11]","[40, 41, 42, 43, 44, 45, 46, 47, 48, 49, 50, 51, 52, 53, 54, 55, 56, 57, 58, 59, 60, 61, 62, 63, 64]",0.0,0.0,0.0,0.0,1.0,1.0,1.0,1.0,1.0,0.7857142857142857,0.7857142857142857,0.7857142857142857
1550,"Yeah, there is no law against stupidity and no fix for it either.","[[30, 38, 'Toxic']]",Yeah  there is no law against stupidity and no fix for it either ,"[30, 31, 32, 33, 34, 35, 36, 37, 38]","[30, 31, 32, 33, 34, 35, 36, 37, 38]","[30, 31, 32, 33, 34, 35, 36, 37, 38]","[30, 31, 32, 33, 34, 35, 36, 37, 38]","[30, 31, 32, 33, 34, 35, 36, 37, 38]",1.0,1.0,1.0,1.0,1.0,1.0,1.0,1.0,1.0,1.0,1.0,1.0
1551,"The countries remaining in the pact have said it's non-negotiable. Hopefully, they'll maintain that stand against the semi- ignorant, mentally deficient demagogue who thinks he has the power to negotiate anything he doesn't like. Trump has become tiresome with his lies, alternative facts and vapid comments.","[[118, 131, 'Toxic']]",The countries remaining in the pact have said it s non negotiable  Hopefully  they ll maintain that stand against the semi  ignorant  mentally deficient demagogue who thinks he has the power to negotiate anything he doesn t like  Trump has become tiresome with his lies  alternative facts and vapid comments ,"[124, 125, 126, 127, 128, 129, 130, 131, 132, 133, 134, 135, 136, 137, 138, 139, 140, 141, 143, 144, 145, 146, 147, 148, 149, 150, 151, 152, 153, 154, 155, 156, 157, 158, 159, 160, 161]","[124, 125, 126, 127, 128, 129, 130, 131]","[124, 125, 126, 127, 128, 129, 130, 131]","[124, 125, 126, 127, 128, 129, 130, 131, 153, 154, 155, 156, 157, 158, 159, 160, 161]","[118, 119, 120, 121, 122, 123, 124, 125, 126, 127, 128, 129, 130, 131]",0.3137254901960784,0.5161290322580645,0.7272727272727273,0.7272727272727273,1.0,1.0,1.0,1.0,1.0,1.0,1.0,1.0
1561,Caldwell is a white collar criminal and perpetual con man.,"[[27, 34, 'Toxic']]",Caldwell is a white collar criminal and perpetual con man ,"[14, 15, 16, 17, 18, 19, 20, 21, 22, 23, 24, 25, 27, 28, 29, 30, 31, 32, 33, 34]","[27, 28, 29, 30, 31, 32, 33, 34]","[14, 15, 16, 17, 18, 27, 28, 29, 30, 31, 32, 33, 34]","[14, 15, 16, 17, 18, 27, 28, 29, 30, 31, 32, 33, 34, 50, 51, 52]","[27, 28, 29, 30, 31, 32, 33, 34]",0.5714285714285714,0.6666666666666666,1.0,0.7619047619047619,0.8571428571428571,0.8571428571428571,1.0,0.8571428571428571,1.0,1.0,1.0,1.0
1564,"Get used to it - Trump is an  idiot with the emotional maturity of an 11 year old.  Not that the USA's political classes didn't require a shake-up but this idiot will, to use a military adage, destroy the village to save it.

I'm betting he's impeached within 2 years, 6 months of assuming office.","[[30, 34, 'Toxic'], [156, 160, 'Toxic']]","Get used to it   Trump is an  idiot with the emotional maturity of an 11 year old   Not that the USA s political classes didn t require a shake up but this idiot will  to use a military adage  destroy the village to save it 

I m betting he s impeached within 2 years  6 months of assuming office ","[30, 31, 32, 33, 34, 156, 157, 158, 159, 160]","[30, 31, 32, 33, 34, 156, 157, 158, 159, 160]","[30, 31, 32, 33, 34, 156, 157, 158, 159, 160]","[30, 31, 32, 33, 34, 156, 157, 158, 159, 160]","[30, 31, 32, 33, 34, 156, 157, 158, 159, 160]",1.0,1.0,1.0,1.0,1.0,1.0,1.0,1.0,1.0,1.0,1.0,1.0
1568,"I always wonder at the Stupidity of the Lefties.  They claim to be ""educated"" but they are really brainwashed.  The Lefties are so stupid they cannot even do basic math.  They demand high wages and low costs - this is just one way their stupidity shows there are many other ways it would take me days to list.","[[23, 31, 'Toxic']]",I always wonder at the Stupidity of the Lefties   They claim to be  educated  but they are really brainwashed   The Lefties are so stupid they cannot even do basic math   They demand high wages and low costs   this is just one way their stupidity shows there are many other ways it would take me days to list ,"[23, 24, 25, 26, 27, 28, 29, 30, 31, 131, 132, 133, 134, 135, 136, 237, 238, 239, 240, 241, 242, 243, 244, 245]","[23, 24, 25, 26, 27, 28, 29, 30, 31, 131, 132, 133, 134, 135, 136, 237, 238, 239, 240, 241, 242, 243, 244, 245]","[23, 24, 25, 26, 27, 28, 29, 30, 31, 131, 132, 133, 134, 135, 136, 237, 238, 239, 240, 241, 242, 243, 244, 245]","[23, 24, 25, 26, 27, 28, 29, 30, 31, 131, 132, 133, 134, 135, 136, 237, 238, 239, 240, 241, 242, 243, 244, 245]","[23, 24, 25, 26, 27, 28, 29, 30, 31]",0.5454545454545454,0.5454545454545454,0.5454545454545454,0.5454545454545454,1.0,1.0,1.0,1.0,1.0,1.0,1.0,1.0
1570,I am surprised. Whole world knows and considers him a stupid..... Why fear him. Make an aliance against him. Move forward. He will be isolated eventually. he cannot bully his allies,"[[66, 77, 'Toxic']]",I am surprised  Whole world knows and considers him a stupid      Why fear him  Make an aliance against him  Move forward  He will be isolated eventually  he cannot bully his allies,"[54, 55, 56, 57, 58, 59]","[54, 55, 56, 57, 58, 59]","[54, 55, 56, 57, 58, 59]","[54, 55, 56, 57, 58, 59]","[66, 67, 68, 69, 70, 71, 72, 73, 74, 75, 76, 77]",0.0,0.0,0.0,0.0,1.0,1.0,1.0,1.0,0.7142857142857143,0.7142857142857143,0.7142857142857143,0.7142857142857143
1581,Those 33000 Emails were  never lost.  HRC thought she disposed of them so they couldn't be used to put her fat ass in jail.,"[[107, 113, 'Toxic']]",Those 33000 Emails were  never lost   HRC thought she disposed of them so they couldn t be used to put her fat ass in jail ,"[107, 108, 109, 110, 111, 112, 113]","[107, 108, 109, 111, 112, 113, 114, 115, 116]","[107, 108, 109]","[107, 108, 109, 111, 112, 113]","[107, 108, 109, 110, 111, 112, 113]",1.0,0.9230769230769232,0.75,0.6,1.0,1.0,0.7857142857142857,1.0,1.0,1.0,1.0,0.8181818181818182
1592,Haven't you Hillary haters had enough? Sorry your blood lust wasn't satisfied by being able to watch her dragged through the Colosseum  and ripped apart by lions or burned to a stake. What a bunch of nasty misogynists! Pathetic!,"[[206, 216, 'Toxic'], [219, 226, 'Toxic']]",Haven t you Hillary haters had enough  Sorry your blood lust wasn t satisfied by being able to watch her dragged through the Colosseum  and ripped apart by lions or burned to a stake  What a bunch of nasty misogynists  Pathetic ,"[219, 220, 221, 222, 223, 224, 225, 226]","[219, 220, 221, 222, 223, 224, 225, 226]","[219, 220, 221, 222, 223, 224, 225, 226]","[206, 207, 208, 209, 210, 211, 212, 213, 214, 215, 216, 219, 220, 221, 222, 223, 224, 225, 226]","[206, 207, 208, 209, 210, 211, 212, 213, 214, 215, 216, 219, 220, 221, 222, 223, 224, 225, 226]",0.5925925925925926,1.0,0.5925925925925926,0.5925925925925926,1.0,1.0,1.0,1.0,0.8571428571428571,1.0,0.8571428571428571,0.8571428571428571
1609,"Chin, a progressive left winger who is very very dangerous.  Chin is abusing is power, typical of someone with â€œsmall man syndromeâ€. Chin, donâ€™t give us the same progressive bs.  I wouldnâ€™t be surprised if Chinâ€™s name comes up in some sexual harassment/assault allegation soon.  It seems the cat has been let out of the bag against these progressive left wingers.

Hey Chin! You donâ€™t have the b@lls to actually run for a public office â€˜cause you know youâ€™d get clobbered! Prove me wrong...I dare ya!","[[111, 130, 'Toxic']]","Chin  a progressive left winger who is very very dangerous   Chin is abusing is power  typical of someone with  small man syndrome   Chin  don t give us the same progressive bs   I wouldn t be surprised if Chin s name comes up in some sexual harassment assault allegation soon   It seems the cat has been let out of the bag against these progressive left wingers 

Hey Chin  You don t have the b lls to actually run for a public office  cause you know you d get clobbered  Prove me wrong   I dare ya ",[],[],[],"[462, 463, 464, 465, 466, 467, 468, 469, 470]","[111, 112, 113, 114, 115, 116, 117, 118, 119, 120, 121, 122, 123, 124, 125, 126, 127, 128, 129, 130]",0.0,0.0,0.0,0.0,1.0,1.0,1.0,1.0,0.14285714285714285,0.9285714285714286,0.14285714285714285,0.14285714285714285
1610,"""And I have been entirely consistent in my desire not to be perceived as bending or breaking any rules,"" Mr. Trudeau said.

Justin- we all understand how you have a desire not to be perceived, but unfortunately, our perception and not your desire about our perception is what matters.

And moreover,

 ""Obviously, we follow all the rules and I am assured that the folks who are managing my personal finances are following all the rules.""

How would he know either of these two things  he is asserting as truths if he has in fact devolved all of the asset administration into a blind trust situation. Maybe blind, but not deaf regarding the administration of his assets?


Liberal- thy name is hypocrisy.","[[693, 701, 'Toxic']]"," And I have been entirely consistent in my desire not to be perceived as bending or breaking any rules   Mr  Trudeau said 

Justin  we all understand how you have a desire not to be perceived  but unfortunately  our perception and not your desire about our perception is what matters 

And moreover 

  Obviously  we follow all the rules and I am assured that the folks who are managing my personal finances are following all the rules  

How would he know either of these two things  he is asserting as truths if he has in fact devolved all of the asset administration into a blind trust situation  Maybe blind  but not deaf regarding the administration of his assets 


Liberal  thy name is hypocrisy ","[693, 694, 695, 696, 697, 698, 699, 700, 701]","[693, 694, 695, 696, 697, 698, 699, 700, 701]","[693, 694, 695, 696, 697, 698, 699, 700, 701]","[693, 694, 695, 696, 697, 698, 699, 700, 701]","[693, 694, 695, 696, 697, 698, 699, 700, 701]",1.0,1.0,1.0,1.0,1.0,1.0,1.0,1.0,1.0,1.0,1.0,1.0
1622,"Don't be ridiculous. He was armed and attacking the officers. It wouldn't matter if he was Black, White, Asian etc. Get a grip on yourself and stop trying to stir up mess where there is none.","[[9, 18, 'Toxic']]",Don t be ridiculous  He was armed and attacking the officers  It wouldn t matter if he was Black  White  Asian etc  Get a grip on yourself and stop trying to stir up mess where there is none ,"[9, 10, 11, 12, 13, 14, 15, 16, 17, 18]","[9, 10, 11, 12, 13, 14, 15, 16, 17, 18]","[9, 10, 11, 12, 13, 14, 15, 16, 17, 18]","[9, 10, 11, 12, 13, 14, 15, 16, 17, 18]","[9, 10, 11, 12, 13, 14, 15, 16, 17, 18]",1.0,1.0,1.0,1.0,1.0,1.0,1.0,1.0,1.0,1.0,1.0,1.0
1631,"Trump Suggests China May â€˜Put A Heavy Moveâ€™ On North Korea After Missile Test

Trump is still twittering away like the twit he is.

What a buffoon.","[[139, 145, 'Toxic']]","Trump Suggests China May  Put A Heavy Move  On North Korea After Missile Test

Trump is still twittering away like the twit he is 

What a buffoon ","[139, 140, 141, 142, 143, 144, 145]","[139, 140, 141, 142, 143, 144, 145]","[139, 140, 141, 142, 143, 144, 145]","[139, 140, 141, 142, 143, 144, 145]","[139, 140, 141, 142, 143, 144, 145]",1.0,1.0,1.0,1.0,1.0,1.0,1.0,1.0,1.0,1.0,1.0,1.0
1644,"This happened in 2012, Obamacare took effect in 2014. But your hatred for poor people is duly noted â€” that was your point, right? Poor people are loathsome fools that don't deserve any healthcare ever, right?","[[63, 68, 'Toxic'], [146, 154, 'Toxic'], [156, 160, 'Toxic']]",This happened in 2012  Obamacare took effect in 2014  But your hatred for poor people is duly noted   that was your point  right  Poor people are loathsome fools that don t deserve any healthcare ever  right ,"[156, 157, 158, 159, 160]","[156, 157, 158, 159, 160]","[156, 157, 158, 159, 160]","[156, 157, 158, 159, 160]","[63, 64, 65, 66, 67, 68, 146, 147, 148, 149, 150, 151, 152, 153, 154, 156, 157, 158, 159, 160]",0.4,0.4,0.4,0.4,1.0,1.0,1.0,1.0,0.7857142857142857,0.7857142857142857,0.7857142857142857,0.7857142857142857
1665,That is my son. You are an uneducated pompas asshole!,"[[27, 51, 'Toxic']]",That is my son  You are an uneducated pompas asshole ,"[45, 46, 47, 48, 49, 50, 51]","[45, 46, 47, 48, 49, 50, 51]","[45, 46, 47, 48, 49, 50, 51]","[45, 46, 47, 48, 49, 50, 51]","[27, 28, 29, 30, 31, 32, 33, 34, 35, 36, 37, 38, 39, 40, 41, 42, 43, 44, 45, 46, 47, 48, 49, 50, 51]",0.4375,0.4375,0.4375,0.4375,1.0,1.0,1.0,1.0,0.8571428571428571,0.8571428571428571,0.8571428571428571,0.8571428571428571
1668,"Who to believe... the woman who say they were sexually harassed,  or the guy that brags about grabbing women by the pussy?","[[116, 120, 'Toxic']]",Who to believe    the woman who say they were sexually harassed   or the guy that brags about grabbing women by the pussy ,"[116, 117, 118, 119, 120]","[116, 117, 118, 119, 120]","[116, 117, 118, 119, 120]","[116, 117, 118, 119, 120]","[116, 117, 118, 119, 120]",1.0,1.0,1.0,1.0,1.0,1.0,1.0,1.0,1.0,1.0,1.0,1.0
1685,This idiotic. Use the surplus to pay down the provincial debt. I would earmark at least half the surplus to pay down the provincial debt. Reduce the debt service cost.,"[[5, 11, 'Toxic']]",This idiotic  Use the surplus to pay down the provincial debt  I would earmark at least half the surplus to pay down the provincial debt  Reduce the debt service cost ,"[5, 6, 7, 8, 9, 10, 11]","[5, 6, 7, 8, 9, 10, 11]","[5, 6, 7, 8, 9, 10, 11]","[5, 6, 7, 8, 9, 10, 11]","[5, 6, 7, 8, 9, 10, 11]",1.0,1.0,1.0,1.0,1.0,1.0,1.0,1.0,1.0,1.0,1.0,1.0
1698,Idiots blame the tool for the loss of their loved one instead of the man using it.,"[[0, 5, 'Toxic']]",Idiots blame the tool for the loss of their loved one instead of the man using it ,"[0, 1, 2, 3, 4, 5]","[0, 1, 2, 3, 4, 5]","[0, 1, 2, 3, 4, 5]","[0, 1, 2, 3, 4, 5]","[0, 1, 2, 3, 4, 5]",1.0,1.0,1.0,1.0,1.0,1.0,1.0,1.0,1.0,1.0,1.0,1.0
1704,Stupid Idea,"[[0, 5, 'Toxic']]",Stupid Idea,"[0, 1, 2, 3, 4, 5]","[0, 1, 2, 3, 4, 5]","[0, 1, 2, 3, 4, 5]","[0, 1, 2, 3, 4, 5]","[0, 1, 2, 3, 4, 5]",1.0,1.0,1.0,1.0,1.0,1.0,1.0,1.0,1.0,1.0,1.0,1.0
1709,"Fuck the CETA, it only works in favour of the rich and does nothing for the people of Canada, just the politicians and those crooks, who will use it to get, more out of Canada, then we get out of them.  Look at NAFTA, what did we get from that... Nothing.","[[0, 3, 'Toxic']]",Fuck the CETA  it only works in favour of the rich and does nothing for the people of Canada  just the politicians and those crooks  who will use it to get  more out of Canada  then we get out of them   Look at NAFTA  what did we get from that    Nothing ,"[0, 1, 2, 3, 125, 126, 127, 128, 129, 130]","[0, 1, 2, 3, 125, 126, 127, 128, 129, 130]","[0, 1, 2, 3, 125, 126, 127, 128, 129, 130]","[0, 1, 2, 3]","[0, 1, 2, 3]",0.5714285714285714,1.0,0.5714285714285714,0.5714285714285714,0.6153846153846154,1.0,0.6153846153846154,0.6153846153846154,1.0,1.0,1.0,1.0
1714,"Absolutely disgusting government. Another example of the baby-boomers living it up and leaving the bill to their children. All in an attempt to buy votes from stupid people and after living through the last 20 years here I'm pretty sure it will work.

Disgusting.","[[11, 20, 'Toxic'], [159, 164, 'Toxic']]","Absolutely disgusting government  Another example of the baby boomers living it up and leaving the bill to their children  All in an attempt to buy votes from stupid people and after living through the last 20 years here I m pretty sure it will work 

Disgusting ","[159, 160, 161, 162, 163, 164]","[159, 160, 161, 162, 163, 164]","[159, 160, 161, 162, 163, 164]","[159, 160, 161, 162, 163, 164]","[11, 12, 13, 14, 15, 16, 17, 18, 19, 20, 159, 160, 161, 162, 163, 164]",0.5454545454545454,0.5454545454545454,0.5454545454545454,0.5454545454545454,1.0,1.0,1.0,1.0,0.8571428571428571,0.8571428571428571,0.8571428571428571,0.8571428571428571
1720,"This is a community,â€ Evans said in a brief interview at the Capitol on Wednesday. He added: â€œI never talk business at my dinners.â€

Dude, your dinners ARE your business.   

The worst of this is that this is standard behavior for all parties involved 365 days per year.  As was shown during the CBC scandal, our legislators can be bought for so, so cheap. Vote every one of these corrupt scumbags out of office.  Less than six months until early voting begins.","[[389, 396, 'Toxic']]","This is a community   Evans said in a brief interview at the Capitol on Wednesday  He added   I never talk business at my dinners  

Dude  your dinners ARE your business    

The worst of this is that this is standard behavior for all parties involved 365 days per year   As was shown during the CBC scandal  our legislators can be bought for so  so cheap  Vote every one of these corrupt scumbags out of office   Less than six months until early voting begins ","[381, 382, 383, 384, 385, 386, 387, 389, 390, 391, 392, 393, 394, 395, 396]","[381, 382, 383, 384, 385, 386, 387, 389, 390, 391, 392, 393, 394, 395, 396]","[381, 382, 383, 384, 385, 386, 387]","[381, 382, 383, 384, 385, 386, 387, 389, 390, 391, 392, 393, 394, 395, 396]","[389, 390, 391, 392, 393, 394, 395, 396]",0.6956521739130435,0.6956521739130435,0.6956521739130435,0.0,0.9285714285714286,0.9285714285714286,0.9285714285714286,0.9166666666666666,1.0,1.0,1.0,0.8461538461538461
1738,"That freak surely never belonged in there. What kind of person is obsessed with creepy racist books like the Camp of the Saints?


Racist dirtbag. So glad this scum is out of there.","[[131, 144, 'Toxic'], [160, 163, 'Toxic']]","That freak surely never belonged in there  What kind of person is obsessed with creepy racist books like the Camp of the Saints 


Racist dirtbag  So glad this scum is out of there ","[5, 6, 7, 8, 9, 160, 161, 162, 163]","[5, 6, 7, 8, 9, 160, 161, 162, 163]","[5, 6, 7, 8, 9, 160, 161, 162, 163]","[160, 161, 162, 163]","[131, 132, 133, 134, 135, 136, 137, 138, 139, 140, 141, 142, 143, 144, 160, 161, 162, 163]",0.2962962962962963,0.3636363636363637,0.2962962962962963,0.2962962962962963,1.0,1.0,1.0,1.0,0.9285714285714286,0.6428571428571429,0.9285714285714286,0.9285714285714286
1742,"More partisan bullshit. Really, how much are you being paid to shill for Trump? Ugh.","[[14, 21, 'Toxic']]",More partisan bullshit  Really  how much are you being paid to shill for Trump  Ugh ,"[14, 15, 16, 17, 18, 19, 20, 21]","[14, 15, 16, 17, 18, 19, 20, 21]","[14, 15, 16, 17, 18, 19, 20, 21]","[14, 15, 16, 17, 18, 19, 20, 21]","[14, 15, 16, 17, 18, 19, 20, 21]",1.0,1.0,1.0,1.0,1.0,1.0,1.0,1.0,1.0,1.0,1.0,1.0
